<!ELEMENT cardapio (prato+)>

<!ELEMENT prato (nome, descricao, ingredientes, preco, calorias, tempoPreparo)>
<!ATTLIST prato id ID #REQUIRED>

<!ELEMENT nome (#PCDATA)>
<!ELEMENT descricao (#PCDATA)>

<!ELEMENT ingredientes (ingrediente+)>
<!ELEMENT ingrediente (#PCDATA)>

<!ELEMENT preco (#PCDATA)>
<!ATTLIST preco moeda (BRL) "BRL">
<!ENTITY reais "R$">

<!ELEMENT calorias (#PCDATA)>
<!ELEMENT tempoPreparo (#PCDATA)>